{
  "as_of": "2026-08-21",
  "source": "Yahoo Finance chart endpoint; adjusted daily close; public market-data fallback",
  "breadth_definition": "Percentage of the 11 Select Sector SPDR ETFs with a positive total return over the stated trailing trading-day window.",
  "limitation": "Tradable sector-breadth proxy; not NYSE/Nasdaq advance-decline breadth and not constituent-level participation.",
  "latest": {
    "daily_breadth_pct": 72.7,
    "five_day_breadth_pct": 27.3,
    "twenty_day_breadth_pct": 72.7,
    "spy_five_day_return_pct": -1.37
  },
  "files": {
    "raw_input": "data/2026-08-21/market_breadth_raw.json",
    "calculation_output": "data/2026-08-21/market_analytics_detail.json"
  }
}
